{
  "schema_version": "1.0.0",
  "strategic_memory_record_id": "strategic_memory_record_traceability",
  "workspace_id": "ws_productos_v2",
  "thesis": "Traceability and reliability would be the earliest trust wedge for ProductOS.",
  "supporting_signals": [
    "Leadership repeatedly asked for stronger evidence visibility.",
    "Workflow and artifact design already favored explicit provenance."
  ],
  "later_outcome": "The thesis proved correct, but it did not fully differentiate ProductOS at the strategy layer.",
  "lesson": "Trust is necessary but insufficient; the system also needs upstream strategic leverage.",
  "repeated_traps": [
    "Over-optimizing for polished outputs before distinct option framing exists."
  ],
  "created_at": "2026-03-20T12:30:00Z"
}
